2237,6285_9_598bb2c3aca4b0d9025351763fc4b8f1,Ha funzionato tutto per il meglio.
2238,6285_9_59a6173b0931682e90ec1fb7c3d1bd63,.per la cortesia e la competenza dell'operatore
2241,6285_9_59c581a88d22f47f4411328b70b5fc7d,"nell’era della super comunicazione in tempo reale, dato che ho email TIM e anche la app my Tim mi aspetto di ricevere più informazioni, compreso su motivi e perchè fibra non arriva ancora a più di 30G"
2242,6285_9_59ea39d9248f474d5eeb171ff08fcf38,Tecnico bravo
2244,6285_9_5a06a8d3b7ccf37cd57330cc625613bd,Cortesia operatori e tecnici  Ma problema non risolvibile
2246,6285_9_5a2ef6cbd523691f62331c5d78917a4d,La soluzione al problema è stata rapida e funzionale
2249,6285_9_5a3fa7ed8315b80943434a95f02ac0f8,"Perché con meno frequenza il problema si ripresenta (salto della connessione per fibra ottica, quando arriva una chiamata salta la linea). Unico dubbio il tecnico si è portato il vecchio modem"
2250,6285_9_5a43645a528d64e537d7bd60c97a3f03,"L'operatrice é stata molto attenta alle mie esigenge con alta professionalit, risolvendo il problema in pochi minuti."
2251,6285_9_5a5a382e7080ca5aeaa886693d5201fc,Contatti telefonici lenti
2252,6285_9_5a5bb6f56782fac772e659ba2326b938,"Solo l'ultimo tecnico ha capito il problema risolvendolo. Per due mesi sia al telefono che dal vivo, incompetenti.addirittura mi è stato attaccato il telefono in faccia."
2253,6285_9_5a681a1c20f0e5984aae4b68fce85db8,La signorina è stata molto gentile e competente
2254,6285_9_5a6da2e89ca4628fa8f195a641e3d8f2,Soddisfatto
2255,6285_9_5a6fc5605b828c4acdd10cd6a8657b92,Operatore competente ed efficiente
2256,6285_9_5a86f44f746c40bd68d3575061644673,"Personale competente e cordiale, problema risolto in pochissimo tempo"
2257,6285_9_5a971638d056b8d56df31b30514bfb52,Capacità di cercare e risolvere il guasto nel minor tempo possibile.
2258,6285_9_5a993eece3e1f4fda90aa9278484df13,Buon servizio e risoluzione in tempi accettabili
2260,6285_9_5aae5697ddcc452276fb91043c35fa98,Perché è stato un buon sevizio è molto professionale
2261,6285_9_5ab3a90fb2bd0eaa0b09de905d9ece28,Per le risposte prima date¿¿
2265,6285_9_5ad3b396c7153460619751f5009ca6b7,Tutto risolto
2270,6285_9_5b0206314580b9304702034dfab39343,Per l'ottima assistenza
2272,6285_9_5b03f8cd3b895c358b01e2b7353bd42a,Servizio eccellente e problema risolto
2273,6285_9_5b0d6949b2b0ea9eac9be9edde908330,L'operatrice è stata gentile e veloce nel risolvere il problema
2274,6285_9_5b0d9e120162aa2882c26810058fdaee,Per la gentilezza e cortesia
2276,6285_9_5b101cf7bf8be6b25236eac3076ffea0,Buono ma sempre migliorabile
2279,6285_9_5b28ea3bd1cc5b5ce65a3b067500a9e1,Buona gestione
2280,6285_9_5b2b32b5676069fca10dbab77933896b,Il servizio è stato sufficientemente pronto.
2281,6285_9_5b3d148019e076d228192a823b2718c6,"Perché l’operatore è stato molto professionale, cortese e veloce nel risolvere il problema"
2283,6285_9_5b4468a475f37eca2d1fc69550d11253,Assistenza ottima personale preparato e disponibile. Complimenti
2286,6285_9_5b6bae9d8adde16edb404e78c9d093b1,Sono stato contattato telefonicamente e con email dal 187 per sostituire il modem Fibra con uno Tecnicolor. La sostituzione è avvenuta con modem Sercom. Comunque tutto funziona.
2287,6285_9_5b79950d6b1d4ef8cf972639d3432a6c,"La segnalazione aveva come oggetto ""navigazione lenta"" invece di 200Mb era circa 50Mb, dopo il primo intervento e circa circa 80 Mb adesso. Pertanto sono insoddisfatto."
2290,6285_9_5b8a2930d842a2a460b103121836c035,C
2291,6285_9_5b8a5ca0a804533544a27b448c76981a,Hanno trovato la soluzione tecnica anche se permangono problemi di collegamento ballerino
2292,6285_9_5b90c4066c3ea85b7a3b422f0cc495ff,Buon servizio Operatore qualificato e gentile
2294,6285_9_5b9db01fc35098fef2603f9ccb171102,Professionalmente preparati
2296,6285_9_5bb56043b0b9ae561df2fb1293918203,perche ha adesso altri telepono non ci riesco a conettere nel wifi... ce guasto nella linea
2297,6285_9_5bc5bfae3161c6210812dfb7973ccc89,Ottimo preciso e puntuale
2298,6285_9_5bc818d41797749d413ea3dbb6ed5b1f,Sono stati gentili
2299,6285_9_5bc8316f2f3496cc479d1435cfab4d39,X la professionalità
2300,6285_9_5bd95982a1a184494f6e10662872377b,Perché la pwrsona che mi ha risposto mi è sembrata competente e desiderosa di risolvere il mio problema al più presto.
2302,6285_9_5be3209ecaa4641a41acca4640bffd4d,Hanno risolto il problema
2303,6285_9_5be618e6cfb187f86da28bcab68c00f8,"Perché ho dovuto richiamare un paio di volte nell""arco di un mese,"
2304,6285_9_5be878094b93ab2f4064342e37455121,Problema risolto
2306,6285_9_5bf91fecf17902bfe807a14c9cb42528,Servizio cortese e veloce. Tempi brevi senza intervento del tecnico
2307,6285_9_5bfa097d31dcf592edc67a0d1ff1ca62,Per la velocità di risoluzione del problema nel weekend di domenica.
2308,6285_9_5c05252046b7ad13ada7ba153ab737ef,Velocità e professionalità del servizii
2310,6285_9_5c261fabbd37c8e6303c1dab8f7af9f2,La risoluzione è avvenuta nei tempi ed il tecnico e stato scrupoloso nei controlli e veloce nella riparazione
2311,6285_9_5c2808ed0729c672720d3c287919a435,Sono soddisfatto
2312,6285_9_5c2d40c6f4c04f6c3691cab06ec57ae8,"Il servizio è più che discreto, gli operatori,quando intervengono, sono cortesi e competenti, i problemi si risolvono in tempi accettabili"
2313,6285_9_5c350fb09b15f7221bc5902df089ebca,"Problema risolto nella giornata successiva alla segnalazione . Il tecnico ha chiamato quando era sotto casa , per cui ha dovuto aspettare il mio arrivo"
2318,6285_9_5c4be0a5004bb6abf6080d0cff7c7f78,Perché scopro dopo un anno di aver pagato per fibra che non arriva a casa mia. Max velocità 25mb
2319,6285_9_5c50c9f650df5a3f9da574decfba1c79,si sono dimostrati competenti
2321,6285_9_5c67c52078464ba637ad5766faa32ecf,"Nel complesso sono soddisfatto della facilità di raggiungere l’operatore, e dei tempi di risposta."
2323,6285_9_5c7eec104149ad9d981e79d91fd3d132,"Call center prima telefonata operatrice da Romania che non ha capito nulla del problema, seconda chiamata operatrice italiana competente, e in seguito tecnico decisamente competente ( per fortuna)"
2324,6285_9_5c80243456db6d9fd4d90a7c8b01804e,Disponibilità e tempestività
2325,6285_9_5c827ac59594f1119493bf96cd589174,Operatore molto preparato e competente oltre che pronto alla soluzione
2326,6285_9_5c9de857968449248334967ef253dfaa,La perdita di tempo per poter parlare con un operatore
2327,6285_9_5c9ff6b416e62d8394e7c41a6a980891,Servizio telefonico conforme agli standard
2329,6285_9_5cb0ae24e801221114ca0a1fd6c508be,Si è potuto risolvere alla seconda telefonata e non alla prima
2331,6285_9_5cb7797e1cb643302bb6ea486cc2d165,"Disponibilita' ad ascoltare, cortesia, calma, spiegazioni semplici e chiare. Sensazione di essere guidato nella risoluzione del problema."
2332,6285_9_5cb94510402d6a8ce843d0e00bd2b1d2,Per la zelanteria del tecnico
2333,6285_9_5cbb8c7fecede39386690d0b31b66f7c,Soddisfatta e l'operatore molto gentile
2335,6285_9_5cc990a51e5ebd60051ead95500c7845,Sono soddisfatta del risultato
2337,6285_9_5cddb264680b741579d77e8394f8618c,Il tecnico intervenuto si è dimostrato molto professionale e disponibile.
2338,6285_9_5ce73cc29d3908b05877ed50875a6eb5,Per la professionalità e efficenfa
2341,6285_9_5d0e93bb9ebc77469ec3e26715bbd28d,Sollecitudine
2342,6285_9_5d1a467e3cd14b8588cd71f4ddb98955,Il tecnico è stato bravo ed efficente!
2345,6285_9_5d3f40eda735ff113a72dec365539fe9,Velocità e sistemazione del guasto
2346,6285_9_5d5f6527c5256b8e4b9b818bab45c9bf,servizio. velocissimo.operatore sempre cortese e pronto ad aiutarti e a risolvere il problema anche se non sei a casa... conplimenti. il servizio app/tim comodissima. ti contattano subito ...e ti avvi
2352,6285_9_5d8f9813434e205b8b74a02a8233b0b8,Perché sono stato contento delle risposte ricevute ma nn per la mito tecnico
2354,6285_9_5d9af7b3100dd7572a153c06dae283ec,"Cordialità e celerità nonostante ho dovuto fare più solleciti, mi sono state proposte 3 diverse soluzioni e alla fine sono venuti a capo del problema risolto poi immediatamente"
2356,6285_9_5dbdba23e660f17a0c18af1925e2e5bf,Efficacia ed efficienza nella trattazione e risoluzione del problema
2358,6285_9_5dc2c56e8bef1b91a08685083dd6ceca,Per migliorare il servizio
2359,6285_9_5dc70ee815983d3438d2dd5d8ca39fd5,Perché siete stati abbastanza veloci
2361,6285_9_5de54ff29d40d9f9e50e782bea505012,Servizio sufficiente
2362,6285_9_5e01b8509d651782327fd28513361290,Perché si può sempre migliorare
2364,6285_9_5e0ac8d48f4c08a58d1388b6f45cbd0f,Tutto ok
2365,6285_9_5e128e0a79fea4b8e9b0ce39fdb8ce19,Soddisfatta della risoluzione del problema e del operatore che me lo ha risolto
2366,6285_9_5e13b161ac8441b4c7f63e43bc26a5c1,"Nonostante avessi dato il numero di telefono nessun operatore mi ha chiamato, anche solo per informazioni sul tipo di guasto, comunque tutto è andato bene"
2367,6285_9_5e15c3c75b227936eaecd97809c8f07d,Perché ho risolto il problema con intervento tecnico telefonico molto competente
2368,6285_9_5e16b74ae3d91f951c4535479973e1f1,Risoluzione del problema
2369,6285_9_5e2b8e2582b1c4836a5842f77caf99dd,L'operatore è stato molto cordiale e paziente nel seguirmi per risolvere il problema relativo alla connessione.  Molto professionale.
2371,6285_9_5e448557360b53e921b13684be93fdee,Operatori disponibili  Tecnico mediamente disponibile
2374,6285_9_5e5e9ed6db4b2eeee6a577c00384897a,Velocità nell’aorire Segnalazione e dare riscontro. Risoluzione guasto in anticipo rispetto tempi comunicati
2375,6285_9_5e63bf44144f0683034914265d2b59d5,Difficoltà nel far capire il problema all operatore. Il problema si è risolto ma è arrivato comunque un tecnico a casa dopo.
2376,6285_9_5e6df9c2f6bb18f9abe7f0e70aa3ced2,Perché mi è stato risolto il problema che avevo in tempi molto brevi
2377,6285_9_5e6f7aa0f7b92da7caf81aa827293e63,Perché sono rimasto molto soddisfatto del servizio
2378,6285_9_5e7c2b6a6fb5277742795b82c709a1a7,Per la cortesia e la velocità!
2379,6285_9_5e9b3a1203ff6608c70de86fe385decc,Il mio problema è stato risolto velocemente e dopo neanche un'ora dalla mia segnalazione avevo di nuovo l'internet. Grazie
2380,6285_9_5eb06e9e730f78fec16578049b1efd3e,Perché l operatore è stato gentile e capace
2381,6285_9_5eb4a45cb153bd2c03dced210a6cc49d,Tempestivita
2383,6285_9_5ec5b5dbf8adef4f5f5cde6b31a316ac,Perché l'assistenza è stata molto buona
2386,6285_9_5eebb1f738adf09e574e14d7d1bc06fd,Perché rispetto al problema esistente la tempistica con cui è stato risolto è ampiamente soddisfacente e anche la tipologia e cortesia di comunicazione è stata ottima
2387,6285_9_5eec783297f78ab5ef93badd282c3b55,Efficienza della Assistenza Tecnica. Ma il problema era nato nell'ottobre 2017 per cattiva comunicazione e carente gestione della offerta commerciale (2a linea gratuita su modem fibra)
2388,6285_9_5efcaf0068daac0a6cc49848d97a781f,"Nonostante il primo operatore mi avesse dato un'informazione errata, il secondo ha chiarito efficacemente il problema. Grazie operatore #2 ¿"
2391,6285_9_5f1fd4f5cddbcbb9aface5427edb6292,"Avrei dato il massimo punteggio, ma purtroppo sono grato solo all'ultimo vostro tecnico che è stato l'unico a comprendere che il router era difettoso e da sostituire, ora tutto sembra funzionare bene."
2392,6285_9_5f215345ec6f1480adcf804aa4d96660,Perfetti
2394,6285_9_5f25704351c6edde620767ea7e2416be,devono essere piu veloci 4giorni senza telefono
2395,6285_9_5f3ae0271a5978cc8e3175242bf08e22,Per la gentilezza nn da parte di tutti ma di quasi visto che un tecnico mi ha chiuso il telefono. nn capisco come mai se prima il valore della mia 100 mega arrivava in download a 60 Mbps adesso nn più
2396,6285_9_5f3bc8ec3f9042063e9b7a31f23fe92e,Si
2398,6285_9_5f5056f2416224da7da97db06d46195c,Con il tecnico al telefono dopo 20 minuti non e riuscito a risolvere il problema mi aveva detto che il modem e stato ripistinator in vece e stato peggio poi mi hanno richiamato una donna bravalarisolt
2399,6285_9_5f5294322fe604d42fa98766d93cb2fc,Pienamente soddisfatta del servizio ricevuto
2401,6285_9_5f687901ff82d3b890e8bd0126776839,Servizio veloce ed efficace
2403,6285_9_5f7f23ba43927735dacbcec385a04605,Perché a me interessava TIM vision alcune volte riuscivo a comunicare con l’operatore altre volte no.L’operatore italiano molto bravo con uno straniero no quelli italiani sono più gentili e preparati!
2405,6285_9_5fa450a45503cb8099ad98468ec372d5,...
2406,6285_9_5fb3fdd9090a04b2263b97ec87694c79,La celerità nella risoluzione del problema.
2407,6285_9_5fb41b52a3b414db781a700ac2298272,Perché non è stato risolto il problema è pago una linea fibra 300mb che non ho mai avuto
2408,6285_9_5fc408f06314e44926984397a2232d79,Per la correttezza e cortesia dell’operatore e per la capacita di risolvere l’inconvenie verificatosi.
2409,6285_9_5fc83e09dbb3fa8e0d5b89db265fefe0,Mi sembra un ottimo voto.Si puo' sempre far meglio
2413,6285_9_5fe0f0a078a8abdfad68318e74e6dbdf,La gentilezza e la competenza dell' operatore
2414,6285_9_6019b49b9c08e03858ca3f664eb014a6,Incompleta siluzione
2415,6285_9_6026dc4bcbe5e9940159defc15263761,Sinceramente in quanto sia il tecnico al telefono che il tecnico sul posto sono stati cordiali disponibili e hanno fatto quello che potevano fare
2417,6285_9_605d92a31c7bbb47b256c10a69ed3069,Operatore gentile e competente
2419,6285_9_60740859e998e8ea19790e472db8692a,operatore gentile e risolutivo
2422,6285_9_60787ddfb60e9d31cd14ce13418871c5,Molto gentile ed efficiente
2423,6285_9_6078cbc609da0cec028f2ae5491c6ff0,Problema risolto
2424,6285_9_608d142abc83fdfa7293c15048a171ac,Massima cortesia e disponibilità. Massima professionalità e competenza. Nessun costo aggiuntivo.
2425,6285_9_608d40cbbafc4f5e3d80ede9fdac4822,Serietà del servizio
2427,6285_9_60a74b243485e0be097204860f8e481c,Tutto bene
2428,6285_9_60af172e307651e13e25ad06fc117ac9,Per la cortesia e la preparazione tecnica dell'operatrice
2429,6285_9_60b7db8c5bbbcda3ab4884a64882e7dc,"Essendo andato in avaria il modem non potevo usare neppure il telefono fisso, ma l'operatrice ha risolto"
2431,6285_9_60c4981eced9abe3dc3f3508062fc2ae,Nessuno si è ancora fatto sentire
2432,6285_9_60c84e3604dc1614d2b6a7e14965376f,"Tutto ok, prospettato 4 gg per risoluzione problema, cosa che mi avrebbe provocato dei problemi, risolto invece in poche ore"
2433,6285_9_60d49e9a9dcc80b658fea3ace6887d30,La risposta e' stata efficace. Il problema era dovuto al PC.
2434,6285_9_60de640d7bacb3a305da4f42ca8a4858,Richiesta svolta con competenza
2435,6285_9_60e1230a7631020f205448cdd6dcc22a,Soddisfatto
2436,6285_9_60e4569e0f7ff02890d988a659aca78e,Servizio molto efficiente!
2437,6285_9_6113b8d46f9c753810f4a5fb718c4a81,Perche e a pagamento
2438,6285_9_6114af88050762cc6cf7bdb07c0d5df8,Buono il servizio
2440,6285_9_61285aed44aacba6773d02d166a8a194,Soddisfatto
2442,6285_9_612ebf709b6cdd86ed32b7b329598fe3,E stata risolto in parte il  probleme
2443,6285_9_613e32df75da93400f0f8570195cb4d1,Gente molto corretta a spiegare i problemi
2446,6285_9_615ae36668dadd4a4a36d4857c786cf4,Prima di mettere fibra avrebbero dovuto avvisarmi che gli apparecchi andavano configurati
2447,6285_9_615bfc420c97d80ef92ecf82d093eda4,Sono rimasta pienamente soddisfatta
2448,6285_9_6160d909b4337aaad769a617f0264b2f,Efficiente
2449,6285_9_6169adc672c93969629cc6e64e674faa,Operatore molto disponibile e competente
2450,6285_9_616b1d0398dace704a965143637d5891,Mancanza collegamento internet
2451,6285_9_6170560bc2aa774c4e829956ab135e49,Ho dato 10 in quanto il problema relativo alla sostituzione del box timvision è stata abbastanza rapia e anche alla grandissima disponibilità del negozio tim.
2452,6285_9_6172a68f74634ff5011248624bbcdf07,Velocità e comprensione del problema
2453,6285_9_617570402aaa267c8fd8792e71457563,"Perché ho già avuto un problema simile la settimana scorsa e sembrava risolto ma poi si è ripresentato, spero ora sia sistemato definitivamente"
2454,6285_9_619e8474aeb09a71bacc28a40e3202c4,Sodfisfatto
2458,6285_9_61c461ae9f4aa5e57024ef39a6edb8c9,"Ho trovato un operatore competente che mi ha indicato cosa fare nel modem per superare il problema dato, precedentemente, per risolto tramite sms."
2460,6285_9_61e071b3fbd2231a796cf3708b5a2c58,Tempestivitá e competenza
2461,6285_9_61e35152e2034bd332f1aa8bef341099,Intervento non risolutivo
2462,6285_9_61eefb15674e6601fc2f1e74ee0cb23e,semplicità di segnalazione velocità di presa in carico e di soluzione  chiarezza delle comunicazioni via sms/app telefonata gentile e professionale da parte dell'operatore circa l'avvenuta soluzione
2463,6285_9_61efb41652f3395535fba37e8b9d2357,Perché il motivo del guasto l' ho capito dopo aver parlato con 2 operatori diversi
2464,6285_9_61fb8342c5ea743f36eebde03d18df59,problema subito risolto e gentilezza
2465,6285_9_62081b1853a5798b538341fb8f613555,Affidabilità
2466,6285_9_620e81ea605888d7780fea589ae2a0f2,Ho risolto il problema dopo che il tecnico mi ha chiamato
2467,6285_9_6210e360ef90eb3d99fbf3b334e8f12e,Non è colpa di chi risponde se i problemi non sono soluzione di in tempi celeri. Ad oggi sulla mia linea attivata 04/01/2018 non ho ancora il servizio... ..per un problema amministrativo non mio ¿
2469,6285_9_6220ab1dbd3d40b0370656ee586593ec,"Perché sono stati veloci e chiari,l’unico problema che mi avete dato un numero business e io sono privato e tutte le volte è un casino parlare con l’operatore"
2471,6285_9_62220f133aed0e1c6ce0f2434aa058eb,Mi è sembrato competente
2472,6285_9_62490bf0bbf84a9dabf8e9a5ebb85993,È stato bravo a risolvere il problema
2473,6285_9_624cc98439b58598dc09d8bb5fb2a97c,Per l’efficienza mostrata e la gentilezza dell’operatrice che ha informato dell’avvenuta soluzione del problema
2474,6285_9_62507da258af470863ad9b3e51774e47,"Rapidità della risposta, ma mi è stato detto che è un problema di incompatibilità TV, e TV box. Strano che hanno sempre funzionato."
2479,6285_9_626f5b9627f4030fb3fba368c0d3ee49,Per il buono servizio
2480,6285_9_6270b22bdc8fa74601dde9cde4680ce4,Operatori al telefono e tecnico a domicilio preparati e cortesi
2481,6285_9_62712e95a660873e8e2466dcabf3b6b6,"Il servizio è stato efficiente, e l'operatore molto disponibile."
2482,6285_9_627ee1f1810d232c12023d114ce0b559,"Celerità,cortesia e semplcità"
2483,6285_9_6286cd0f085e2b22197366be3dd91399,Perché sono pienamente soddisfatto di tim. Prodotto- operatori- tecnici.
2485,6285_9_62931482afccdfd46c08bad978e9d6ed,Non so
2486,6285_9_629dce5b3fa608f91cfd4e2642f084cb,Ottimo servizio
2488,6285_9_62c83321d222e9e282ff3179ab4f6e9c,Hanno risolto il problema e sono stati tutti gentili
2489,6285_9_62ceab5a6998982cc6a842afd702eb29,"Buongiorno,do 10 per l'assistenza ma che non ci sarebbe stato bisogno se mi avessero dato il router giusto,cosa che ha fatto l'ultimo tecnico che è venuto! Quindi per 2 mesi ho avuto un disservizio !!"
2492,6285_9_62ed1ffe37f38ef6a2171532fc0ed29f,Per la competenza  del  problema risolvendolo
2495,6285_9_62fc740ad1b6ea8bb670ad4fe403ece5,Rapido e molto cortese
2496,6285_9_63047d83ab480340099bbeb468c7a797,Ho trovato per una volta una persona in gamba e cortese che ha capito subito il mio problema e me lo ha risolto velocemente.
2497,6285_9_631a511a57260299bfb4f69fb507e746,L'operatore è stato molto competente e professionale. È riuscito a trovare il problema (dovuto a 2 mancati aggiornamenti firmware del router).
2498,6285_9_63230b5606cd0f8587ff47697e971ec0,servizio veloce
2500,6285_9_635055013b36807cb0852d104bdf5aa9,Perché ogni tanto si verifica lo stesso problema ogni tanto si isola il telefono
2501,6285_9_63513aeb20bf0496210222cee534932c,Professionalità
2502,6285_9_63532737cc1fdadaa7ea11bc2a7a4685,Operatori efficientissimi ma scarso servizio della Tim  Pessima la fibra  Chiesti 100 mega ne arrivano appena 39
2503,6285_9_6353d718eb8f7fef2854e4f50cd2647c,I tecnici dell'assistenza sono molto disponibili e preparati. Risolvono i problemi subito sono il valore aggiunto che contraddistingue tim dagli altri operatori
2504,6285_9_635f08176ac5fbbc0d37d83b23f1f70e,Efficacia e professionalità...
2505,6285_9_6379f3dea4d25f1f0bfab72ef5d747d1,Professionalità e tranquillità dell’operatore ed apprezzabile la sua conoscenza
2507,6285_9_6390b44cbbe8b68422a787def17b9d0e,Massima cortesia del operatore. I tempi rispettati
2508,6285_9_63923833f8b7c6c81f3ee97ea4c21cd1,Cortesia e velocità nel risolvere il guasto
2511,6285_9_63ca35dc741b26fc3aeb66684be9a9cc,Il problema segnalato è stato risolto
2512,6285_9_63dc1f0274ec61380709e57a4396f199,Perché soddisfatto del servizio
2513,6285_9_63dda63793c65a8127818f14cfba15d8,Cordialità
2514,6285_9_63f4865bbec5ef969c8a099b9e12b2f0,Molto disponibili
2515,6285_9_63f9cba823b980e715702b4238e95207,Soddisfazione.
2516,6285_9_63fa563a870e48d9c17f1c11bd9cd57c,Mi ha risolto il problema.
2517,6285_9_63ff929080a7fa50308810a74ea90730,Operatore gentile e disponibile
2520,6285_9_642420acb618af56335ac5773fa6b9de,"Servizio celere, rapido e cortese"
2521,6285_9_642d00b764a080b2a2e4f6017f46fd21,Perché sto valutando in questi gg
2522,6285_9_642edaebfc423641c73c44b0d8acb491,"Per la professionalità,la cortesia e la disponibilità mostrate"
2523,6285_9_644c35666de4bd1585dcd915aa4f66c0,Si
2524,6285_9_644e2aa6fbf01c6a789c63e1932c0bd7,In questo caso ho avuto un operatore Gentile ma non è stato sempre così per questo motivo il mio voto è 8 e non 10 .
2525,6285_9_6451ab1d5676351215683347c157a4b2,Per la rapidità e gentilezza operatore
2526,6285_9_645c8f59b6a1ccaefde9c159e8e86e76,Prontezza nella individuazione del problema
2528,6285_9_64883fa631a8fa8fa175ad93345a8b32,"Alla fine la tim è sempre la tim, anche con gli inconvenienti"
2530,6285_9_649cd76f9917c29a5f4e6fd1432c9229,Sono soddisfatta
2531,6285_9_64aa6aa606dd5d7654d932362e680918,Nel complesso la pratica è stata gestita bene
2534,6285_9_64bd9e75727c1de58fa5a87266ebeb3c,"Ottima professionalità, mi ha informato dei problemi purtroppo non risolti, farà intervenire altri specialisti."
2535,6285_9_64c0da7307447ff93fb82bda673004cc,Lo considero medio alto
2536,6285_9_64ca75f6dcd69e937aafbe2292ffc299,È stata veloce e ha risolto tutto in breve tempo
2537,6285_9_64e8167de5e75378597a52347da6b7c0,Servizio ottimo
2538,6285_9_64fa5d1a05a1b2c0baf2c62812a2b32e,Dopo anni senza linea fissa e senza internet posso ritenermi soddisfatto dell'avvenuta installazione della fibra. Aspetto solo la bolletta
2539,6285_9_65006936c462c518283ad5a613dac357,Tempi molto lunghi
2540,6285_9_650157e3ea30161187e12250c7bd8fb3,Perche l'ultima operatrice e' Stata molto competente ed ha risolto subito il problema.
2541,6285_9_651b1be0438060ae5813f01b9bb933b0,Soddisfatto pienamente della soluzione
2542,6285_9_651d04ffa52402e78fa01da733c9506c,Per la celerità e la competenza dell operatore
2543,6285_9_6524008ff988d8d53de01ee6eadc231a,Gentile e disponibile
2546,6285_9_653bfcd7c544a20fdf8dee2e13c53671,Poiché sono rimasta soddisfatta del servizio
2549,6285_9_6544da760a22956ab5376bea02c2cb1b,Ho chiesto intervento anche per il passaggio ai 200 Mb ma è caduta la linea prima della conclusione dell’intervento e non sono stato ricontattato
2550,6285_9_6547e392e0e18541af6feff63a9c09f3,Per la cortesia e la pazienza
2552,6285_9_6560b5dcdcb3252dc3351ec20db8dd48,Sono stati gentili ed efficienti
2554,6285_9_657ddf34689f072be4918d0ab6bd9f2a,Operatore gentile ed efficiente
2555,6285_9_658809c980f5bf8d80d16a9f76207591,Veloci nel risolvere. I giorni passati dopo la mia segnalazione sono comprensivi di sabato e domenica
2556,6285_9_6591c65ee9d3a2a8c191f55304addf0c,Perche ci sono voluti un po di giorni per aggiustare il guasto
2559,6285_9_65aa1331c855ce43bf77409c843feab7,Per la celerità dell'intervento e cordialità operatore
2560,6285_9_65b62caf8ec142c5731fab042052ee83,Ho trovato un operatare capace ed efficiente
2561,6285_9_65c704e9461edbddfac675fa6dc6e1d2,Perché l'operatore è stato esauriente ma l'assistenza ancora non si è fatta sentire
2562,6285_9_65c8069808fd57c58ca376f0214aadbc,"Gentilezza, competenza e disponibilità dell’operatore"
2563,6285_9_65d86b6675762c98c6de33a189ba7f81,Wn
2564,6285_9_65d939840f682d14ae3cec1814174bb3,Per il supporto tecnico ricevuto
2567,6285_9_65eb8e3a3888315e9df29f46f0ed6b8e,Per efficenza
2569,6285_9_660f51e28f437f4ee744e65414537605,Cordiali ascoltatore anche di altre domande con risposta pagata
2571,6285_9_6618d22ec478984120e01cb2565d6cc2,Perché sono hanno risolto il problema
2574,6285_9_663fee56c2426e36300623c18046ca9d,Un tecnico estremamente professionale che mi ha chiamato due volte aggiornandomi dall’armadio fibra. Spiegandomi il motivo del calo di potenza del segnale e intervenendo sul problema.
2575,6285_9_664e5b2afae3f2d6244af2615740b577,"Ottimo, nei tempi e nella qualità."
2576,6285_9_665441dad9a58d4c72dcf06af2be5d99,Un errore di valutazione sul guasto da parte dell'operatore e un errore di configurazione del modem (consegnato un tipo non idoneo alla fibra) da parte della ditta subalterna alla tim
2579,6285_9_6663e592a45ee118cafbb1de9acec49e,"Disponibilità, tempistica, professionalità"
2580,6285_9_6671ae52c7b97a689dd3d9485b7cc413,Per la cortesia e rapida risoluzione del problema
2581,6285_9_6673745429e7280dbed6386b1f0e544e,Veloce e cortese.
2582,6285_9_66738fe88181884088b687d75ee2fbb3,Sempre precisi e puntuali
2584,6285_9_66765265f9a6932b16921374a3586832,"Gentilezza,pazienza, professionalita e competenza."
2585,6285_9_669a1dc3a9ac6bfb7676472b4e0f5842,"9 x l'assistenza, ma mi premuro dirvi che la fibra non funziona in maniera dovuta e sto pagando un sevizio che non è nel suo pieno x mancanza di strutture adeguate!"
2586,6285_9_66a06968912c87ae69de9214e5038024,Problema risolto in tempi brevissimi
2587,6285_9_66b0f6d615f2ab97b4456a26d744a4eb,Xchè mi sembra che sia giusto
2588,6285_9_66df564fab3ac4823427783d9230e3db,Rispondete sempre
2589,6285_9_66e20b934439a11eb1d3ea3bb34da4ab,Efficiente dallItalia Non efficiente dalla Romania
2590,6285_9_66ee7158dbfd91841cd8a13a6a3dc1de,Perché sono soddisfatta
2591,6285_9_66ef6eab242e98a122ec84af8fc88372,Info chiare non ho dovuto ricontattare e sollecitare mille volte al numero verde
