4446,6285_9_b0144e73969049e61b37f8da97dc4617,"Perché finalmente è arrivato un tecnico Tim che capiva il problema,non dovete mandare in giro quelli che non sono Tim perché non sono qualificati."
4447,6285_9_b01dbd192c62fd6afca5f89d49443ec7,Perché hanno soddisfatto in pieno le mie esigenze
4449,6285_9_b02e847583ed832a31c2aada2cdcc029,Ers un guasto di zona.Riparato dopo 10 giorni.Allagamento tombino con apparato non protetto.Vergognatevi.
4450,6285_9_b0346f8541e7bc608861c1205b0f6f8d,Non posso usufruire della linea fibra.
4451,6285_9_b045b58bde5b7a89600d32b1d77aa899,Perché no riscontrato competenza e professionalità nel tecnico che è intervenuto.
4452,6285_9_b04f10edb65c2da420e389314bb4bd21,Rapidità e conoscenza tematiche
4453,6285_9_b05678d7edd48847983733c96666b020,Professionalita'
4456,6285_9_b082e66d4d4a70fefb3c6d17c4ebdd7c,Avrebbero potuto farmi parlare con un operatore tecnico già il giorno successivo
4459,6285_9_b0a9cecabf0c64b35813230af4fb25d4,"Ho dovuto parlare con 2 operatori prima di risolvere. Il 1o non ha capito il problema è ha continuato a ripetere formule fatte. Solo il 2 ha ascoltato (sono un informatico, mi sento preso in giro)."
4460,6285_9_b0b210c176bfd343c9f22e9db29b9423,Disponibilità dell'operatore e velocità della risoluzione del problema.
4462,6285_9_b0c14a2c0fd3a0bbdc2675fcd6469ee0,"Ho dato solo 8 perché nell’ultimo anno il problema si è presentato numerose volte, sia per la fonia che per internet."
4463,6285_9_b0d5f1e634d1f2e24398489c2d566b67,Troppo complesso segnalare che dopo il primo sms il problema non era risolto
4465,6285_9_b0d95795e99a7871efe03c4861e532d2,Il problema e stato risolto in breve tempo
4466,6285_9_b0daf7ac776081254436763cb55eb1ce,Tecnico estremamente professionale e competente
4467,6285_9_b0df251ca0c2d8aad6bc79c78750eced,Efficienza e puntualità
4468,6285_9_b0e5cadd8be1c6ca439fa50824650b9b,Ho trovato sempre operatori competenti
4470,6285_9_b0f1d75f7b7cb8f5909f8bca59fc3063,Sono stati cortesi e veloci nel risolvere il quadro.
4471,6285_9_b0facb873fe36aa5428c5ed9ca2e1bd9,La causa del guasto sulla mia linea è stata individuata e risolta in tempi abbastanza brevi
4472,6285_9_b109d23ba59f9a3d7ecf29353aa58306,Soddisfatto della soluzione del problema
4473,6285_9_b11228b422f427e346474d7b63ef96c5,Cortesia e competenza dell'operatore; efficacia dell'intervento
4474,6285_9_b130ce97c0595164efa845f60d724b66,"Molto soddisfatto da come è stato risolto il problema dalla vostra operatrice, molto gentile e disponibile a risolvere la mia problematica"
4475,6285_9_b131fd37d86c6e8277869b96f919ab21,Cirtesua e professionalita della operatrice
4476,6285_9_b142599277ba42bca4d942be197d9d18,Perché ho visto la tempestività della riparazione.
4479,6285_9_b149bc025ec5ccb56a6065882625c0ac,"Risoluzione del problema in tempi brevi, facilità nel contattare centro assistenza"
4480,6285_9_b14b83e9c033eb3ca18ab9b27ca62dfd,"Perché  credo di aver capito che il ritardo nella soluzione (speriamo) definitiva, non sia imputabile al servizio di assistenza, ma ad un problema ""cavo"" dall'armadietto telecom al mio domicilio."
4483,6285_9_b1573e15cec5c9b1573f5b18aa067ccc,Risoluzione in tempi piuttosto brevi (il giorno successivo)
4484,6285_9_b15d5be97c20d5478a31ab70e6dacedc,Per la sollecitudine dell'intervento.
4485,6285_9_b172d41d439144e20a7fc0f676a8cc3a,"Il tecnico che è venuto a casa mia per risolvere il problema era preparato e molto educato, un po meno l’operatore con cui ho parlato, nel complesso ho ricevuto una buona assistenza."
4487,6285_9_b191f7a1cd4311f2cbbab08d1833b13d,Tuto ok. Ottima conoscenza della signora che mi ha seguito
4489,6285_9_b193b4cf88370da9466a1e2d1c7b861d,"Preparazione tecnica, educazione nei modi, disponibilità piena a qualsiasi domanda."
4491,6285_9_b1af4dd68aa53175142ea0cc85372a4e,Bravi operatori al 187
4492,6285_9_b1ca005e382ee925cfc7ee203993b625,Ho capito quale è il problema
4493,6285_9_b1ce230858ac7b7087aa0b4303bd68b9,Il problema non è ancora risolto devono ancora intervenire ma la linea funziona anche se in regime basso
4494,6285_9_b1ea2f14f3f5328d8ecfef613b9c85c6,"Tempi di intervento,cordialita' e consigli tecnici del tecnico"
4498,6285_9_b1fa0e9bea8ca2ed46993305c64f0428,Perché il guasto è stato risolto in breve tempo e senza problemi. Premetto che era stato segnalato già sa altri utenti della zona.
4501,6285_9_b20e5e608483a38ce397032b9eb11486,Servizio ottimo.
4502,6285_9_b210418eb3e7bc2a89c03c306fecc5ea,Professionalità e cortesia
4503,6285_9_b2178d8d805e03b83d0c67431d953538,Servizio clienti eccellente
4504,6285_9_b23094c71bf80b772113d82c31cc7dd1,Ha avuti una gentilezza allarmante ¿
4505,6285_9_b231a39c5944a6e9e042e9eab8a3dde7,Il problema è stato risolto solo con una serie di interventi.
4506,6285_9_b23da46c806c26fe31d7015218b4cd1e,"Perche' l'operatore , mi ha risolto un problema mai verificatosi, in precedenza,con l'ADSL: la interruzione della linea telefonica del Modem Fibra"
4507,6285_9_b2406a43d6ef3fe2f72a4758ab71c566,"Il tecnico che finalmente è venuto anche a casa dopo 4 giorni è stato bravissimo, ma nei giorni precedenti non ho avuto mai un feedback o un resoconto del problema: bastava controllare le connessioni"
4509,6285_9_b24c20c228c60c7a8942a42d7a6e3a5e,Effiscenza e competenza
4511,6285_9_b2836c65e3d35aec99b1b0268dbbf749,"Celerità, gentilezza dell’operatore"
4512,6285_9_b2844b79116f65c97808f554b7514376,Il tecnico molto bravo preciso e educato
4517,6285_9_b2a7a0e93bc677e49eb5cbcb94beaea6,Chiarezza di spiegazione
4519,6285_9_b2ca35182e82c4dfc02a5aaeb435e7fe,Efficienza servizio
4521,6285_9_b2d8a01d7b6cf0659ab2c69fb477addc,Perché hanno risolto subito il problema è l operatore da me contattato è stato gentilissimo ed efficiente
4522,6285_9_b2da6f64555582c22b7f68b8162701d3,Serieta intervento
4523,6285_9_b2da712e18c25dad89dfbad8e830007f,Perché sono abbastanza soddisfatta
4529,6285_9_b338833e9e4ba5db47979265d614d2a7,Per gentilezza e professionalità
4530,6285_9_b34404d27b763d2183b7ec4e58aa7ee3,Perché sono stata abbastanza soddisfatta
4531,6285_9_b35d9180fdd41711e2f7020f7840b548,Perché c'è attenzione nei confronti del cliente
4532,6285_9_b35efca5f19c0b8da4a4b06c96e128d0,Sono molto soddisfatta
4535,6285_9_b3786d7a6441b9addcae449c7d616792,"Perché il tutto è stato gestito in maniera più che buona, ma non eccellente"
4540,6285_9_b3b9ab0614943ff5b62cacdbcaa22ae7,Per la professionalità e la gentilezza degli operatori che mi hanno risposto
4541,6285_9_b3bd24fbd1a50cad625972141ac84727,"Si è spento il modem dopo 8gg dalla prima installazione, visto il breve tempo mi aspettavo la sost.a casa. Sono andato io al vs centro perché chiedevate circa 30€ x la sostituzione a casa"
4542,6285_9_b3c0442e97e77fa2ffd9cd900d977d08,Anche se non ho risolto il problema alla prima telefonata ogni operatore/tecnico con cui ho parlato è stato molto gentile e ha cercato di risolvere il problema.L'ultima operatrice ha visto modem rotto
4544,6285_9_b3d51d95e2eacecc6401cd0b703fbb7b,ok
4545,6285_9_b3d6af79bf2016efb73514445432ab08,"Ha risposto una ragazza gentilissima,cortese ed eccellente nella risoluzione del problema."
4546,6285_9_b3d896a844d975ac3733634baca5344e,qqqqqqqqqqqqqqqqqqqqqqqqqqqqqqqqqqqqqqqqqqqqqqqqqqqqqqqqqqqqqq
4547,6285_9_b3eef0831c8b7e7ace7e05519d70744b,Rapidità e competenza
4548,6285_9_b3f96d9c8c177f7ec025bb74ea31e359,Soddisfattissimo della TIM
4549,6285_9_b414ba7cfd40203ceb80c2c5886cbaaa,Disponibili e competenti.
4550,6285_9_b417854f7c5e7717a314113ffcc0e78a,Ha funzionato tutto e rapidamente .Mi hanno consentito di usare il telefono in 30 minuti
4551,6285_9_b41e119c660e4177c189e8b27641193b,Per la disponibilità e gentilezza del tecnico.
4556,6285_9_b46b4989a1087581a1b6f2cd972bdcf7,Tutto ok e molta cortesia
4557,6285_9_b47c424747289f3704e1c327309232ef,Operatore molto cortese e fattivo. Si è preso carico di svariati piccoli problemi. Due su tre sono stati risolti. Il terzo (velocità in download e upload della fibra) no.
4561,6285_9_b491f4268b456b9603c1bc2696b0d77f,Tecnici cordiali e disponibili
4562,6285_9_b495939c255ccf6878a239c6850dfec7,Sono stati gentilissimi.
4565,6285_9_b4a866ebc3c55134cb4155340111ed41,Per la disponibilità e la competenza
4568,6285_9_b4f04dee3ff4be6817225c72ee4dcab8,Perché gho trovato efficiente il servizio e gentili coloro che mi hanno risposto al telefono grazie
4569,6285_9_b4f44e89b6998c19bd3ce92b9e6427e1,Soddisfatto
4570,6285_9_b50e6d48675f3721ea4df1b6128333ad,Perché la risoluzione non è stata rapida
4571,6285_9_b51040da6bf8af97af17716a55c6a6e0,Veloce
4572,6285_9_b5118db1142b32e5f2e5790e8c572c50,Tempistica ed efficienza
4573,6285_9_b5126b15ae106306fdd57f2555a9f7b7,"Sono rimasto soddisfatto, lascio una possibilità normale di miglioramento."
4575,6285_9_b525412e49260aa9cc99d6206037a58d,Soddisfatta
4576,6285_9_b529f70e339c543f9612f4c5cc5a71e9,Risoluzione problema in modo rapido
4577,6285_9_b539f436673e4ca9584cb966a9bb51f9,Affidabile. ..
4579,6285_9_b543c32fd08693c1c740dacf9706bbd5,xché mi piace
4581,6285_9_b544da89937cc9f2d642a141053a6f6d,Eccessiva burocrazia per sostituzione router guasto
4583,6285_9_b561e74cd4a0d496b9e7577961397181,Perché credo che in TIM siano bravissimi a rendere complicate le cose semplici
4585,6285_9_b582a4eaae1366e279f9d1441454177c,Eccellente servizio
4586,6285_9_b5899e1315a757c1899fb3a8f91e17a7,SONO RIMASTO MOLTO SODDISFATTO
4587,6285_9_b59393b87f0ad4b60c5f86380da7868f,Il problema è stato risolto velocemente
4588,6285_9_b59ed20c64a250b563377cbfa4e478db,Non completamente soddisfatto
4589,6285_9_b5a6fca8632f7e544fd4c777d08a41bc,efficace anche se non tempestivo: problema dato per risolto non lo era inizialmente
4590,6285_9_b5a924064a0d1c74665e3913e3b8fae9,"Problema risolto e dovuto anche x mia negligenza ma, forse x colpa del weekend di mezzo, 4 gg di attesa sono cmq tanti."
4591,6285_9_b5bad526d0a4ab08d817c98b266dd085,Ok
4592,6285_9_b5bd3b9cf06c0487c5122aefc9e014ae,"Educazione, tempi brevi e molta competenza."
4593,6285_9_b5c49109e8a935540fc0a889d7796c6f,Operatore molto gentile
4594,6285_9_b5d8c84e8b6a6f51d00d014b4e29a444,"L operatore è stato bravo , il tecnico è intervenuto ha risolto il problema al momento, ma dopo mezz’ora ho avuto lo stesso problema  la quale avevo chiamato ,  con  Timvision."
4595,6285_9_b60d06086ce35ef3e9e8657a4c3ee4f8,Rapida e efficace almeno fino ad ora
4597,6285_9_b620039bc0880af7b0f5f09e3b50002e,"Il livello di efficienza degli operatori che mi hanno contattato era eterogeneo: alcuni hanno palesemente dimostrato disinteresse, mentre altri hanno avuto un atteggiamento competente e professionale."
4598,6285_9_b627b6fadf9817e008ebc680a3acec3c,Efficienti e tempestivi
4599,6285_9_b638be9e400c2a114b6dc94bd45ae29b,Gentilezza e competenza
4600,6285_9_b657db281b80744a32ee23b24c9a0fc5,Gggg
4602,6285_9_b658c20e4ed6e5b422d6b927acffb618,Perché sono soddisfatta
4604,6285_9_b66e2f1dca53516e152a7e0bffebc706,Per la solerzia però il problema  della non ricezione delle telefonate in arrivo è una leggerezza e disattenzione della Tim
4611,6285_9_b6badcc93380510fcbb2542e77ff06b4,Perché il servizio richiesto ritengo sia in fase risolutiva anche se devo essere ancora contattato e l’operatore è stato esaustivo è confortante.
4612,6285_9_b6c18fed85bc8fb2a669b250bd505d33,Per la disponibilità dell'operatore nel risolvere il problema e la professionalità
4615,6285_9_b6dd865c33ddc5f453973390bdd428ba,La signora che ha risposto è stata competente paziente e gentile
4616,6285_9_b6dfc56ead1f6ea469b051632504cc31,Solo per ritardo tecnico.
4619,6285_9_b6f2686cb9edfe0893902859eb0fbb9c,Reale volontà e impegno nel risolvere il problema.
4620,6285_9_b6f4ada00e376352db5790d2dabad20b,"Ogni volta che chiamavo l""operatore mi garantiva che il problema si sarebbe risolto a breve e che sarei stata ricontattato,invece ho dovuto chiamare ogni gg per avere notizie."
4621,6285_9_b6fc8a156988392536e7b5c81d49b6eb,Intervento abbastanza sollecito Esito positivo
4624,6285_9_b71fdff6b689cd4b4c71434822fb6cf0,Per la gentilezza degli operatori
4625,6285_9_b735631d483de5c3f082cc18ce7effab,Perché non avendo chiesto nulla di eccezionale non vedo nessun lavoro difficile Ho dovuto chiamare per avere il nuovo numero di Tel dato che nessuno me lo aveva comunicato!
4626,6285_9_b743e020ad428688a613841455344476,sono stati efficienti risolvendo il problema ben prima di quanto comunicato
4627,6285_9_b75349cece3be99912c75f811791ef1d,Tempi cordialità
4629,6285_9_b759b0cbab87d58e74910bc394d8da04,Perché anche se con un ritardo esagerato alla fine si è riusciti a risolvere il problema
4630,6285_9_b760fdd7790e772110ad1b8fd19376bd,Soddisfatto del servizio offerto. L operatore ha risposto dall italia
4631,6285_9_b76230d3e1fec492e3ab989be7feebff,Completamente soddisfatto
4633,6285_9_b76c4c4c3a3763c9da5cf4360e3cf346,Perché sono stato molto soddisfatto per la risoluzione del quasto in tempi programmati da voi grazie
4634,6285_9_b76e05c7ac2a5137a6fbcda86739c933,Sevizio buono
4635,6285_9_b7703da6d51e4cc981475c6ffd27d7e1,Problema risolto
4636,6285_9_b774c8bfc89e49fa39b904a78495ee23,Modem sostituito prontamente
4637,6285_9_b778bd84df0407c3e6edc8aa671ab723,"L'operatore è stato gentilissimo,e per telefono mi ha garantito che facesse di tutto per risolvere il problema...."
4638,6285_9_b77afab0af39b6a1b7d808dc84416da6,"Velocità nelle risposte, anche se è stato consigliato la sostituzione della spina di collegamento dell’apparecchio fisso che presenta ancora una rumorosità nella cornetta"
4639,6285_9_b78618e56e520231e68be45911db4ff0,Il problema si è risolto in breve tempo
4640,6285_9_b78dc9442137c96170ce16ec59b6b215,"Cortesia,professionalita',celerita'del servizio"
4641,6285_9_b79d6bdc218230e2eb96919b76f592f2,Avrei preferito parlare direttamente con un operatore
4642,6285_9_b7a35b6edc5d7e631b6162c5e8cb985f,Professionalità dell'operatore
4643,6285_9_b7c38857f70f466d127b7ba99b4dcd8d,Tre
4644,6285_9_b7d1b5d66dfadc2de33bf7e5939526d1,Perché ho aspettato 3 giorni
4645,6285_9_b7d35a1f70f3e9a5cf27b1abf99aaa57,Il problema non è stato risolto completamente.
4646,6285_9_b7d56bf2e5d5cf17105cfcbc13500368,8 perché se vi fosse stato un miglioramento tecnico avrei dato 10
4647,6285_9_b7dc10061ca759217f2175c7bab1251a,Perché l'operatrice è stata brava nell'aver risolto il problema ma è la societàTim che mi sta dando noia e non sono affatto contenta tanto che sto valutando di cambiare società.
4650,6285_9_b8195066ad03d13e5ff7eeefeff544f1,"Operatore cortese, competente, ben disposto.ad ascoltare e molto chiaro nell'esposizione, guasto risolto in tempi brevi"
4651,6285_9_b81fb76414366f65a0149eb0d8a6a85d,"Problema risolto in tempi rapidi,ma l'assistenza mi ha chiesto un riscontro la sera,non ero presente e ha chiuso la pratica nelle prime h.della mattina successiva,senza attendere la mia verifica"
4652,6285_9_b824a635286ed89f95e10a96b9ecbbb7,ma non basta ik 10 ? un'altra volta non compilo nulla
4653,6285_9_b84f83729da0dfcd8e059ae1a0fdfaa0,Perché mi hanno risolto subito il problema
4654,6285_9_b861c907e8b72a56fc4f8222cde9eb5c,Perche il problema e' stato risolto.
4655,6285_9_b8767bd8c0e66f365ea691d7fc61d9dd,Perfetti
4657,6285_9_b888a62cbfdcbe4b77c1d4dcef606166,Mi sembra che il tutto sia stato risolto in tempi onesti.
4658,6285_9_b8b0edcdd9c39cd15ade0b4dda410217,"Operatore gentile,risoluzione del problema entro il giorno della segnalazione guasto."
4659,6285_9_b8d6161c49d212556a8375e880b44c81,Mi sono trovata soddisfatta
4660,6285_9_b8d6516cdfd945d6ee6abc0e66153231,Perché mi sono trovata bene e sono stati tutti gentilissimi
4662,6285_9_b8d98228a992e8694efa4e4c860e89e4,Buon servizio
4664,6285_9_b901e7360cc28a89133891329918f88f,Fatti miei
4665,6285_9_b90efec7232e8808beae3a8faec52ab6,Perché non mi era stato da voi fornito il giusto modem per la fibra
4666,6285_9_b9214a34d9dd55e050a9f9ce0654aaae,Perché secondo il tecnico nostro mi si da la colpa che ho un km distante dalla cabina non vero per giustificare poco segnale di connessione che arriva sì e no a 30/32 . Pago di più per ottenere poco.
4669,6285_9_b95f40a7e1c204d50d8abbb5eea66a28,Tempi brevi
4670,6285_9_b972c64980cfe1c484d1718105407899,Perché mi hanno trattato bene e hanno risolto subito.
4671,6285_9_b9765404bdb88572606bae30daf52efb,Cortese e competente
4672,6285_9_b97e78658e8747b830ec179ed3972984,Gentili e professionali ma ho dovuto aspettare anche se la segnalazione era a cavallo di giorni festivi
4673,6285_9_b98e0158d0c613fcecc74cb1440a9c1d,Questa volta sono rimasta contenta perché il problema è stato risolto in breve tempo.  Avevo contattata l'assistenza altre volte per un problema alla fibra ma non era successo niente.
4674,6285_9_b99f0c3ab45a974d1388eb9bfb7d8359,"Problema risolto parzialmente con la prima chiamata,e risolto completamente alla seconda"
4675,6285_9_b9a391003af222699057363d5a9094cf,Penso e spero che il problema si sia risolto nel migliore dei modi
4676,6285_9_b9b533eecff710e6fd8e8ec22a72bb42,Servizio professionale
4677,6285_9_b9e09998344022f5f8f340f625d452a3,L' operatore telefonico ha dimostrato disponibilità e competenza
4678,6285_9_b9eabc7dc9c3b1ba7609fec4832daf26,Per la rapidità e la precisione
4679,6285_9_b9ec12db8f40825c6d0c8ee4bac0df9c,Per efficienza del servizio. Ho dovuto segnalare il guasto ad un operatore del commerciale perché precedente mente il servizio guasti non mi ha contattato.
4682,6285_9_ba1d97039d98ad58575c5158f553b7da,Per intervento  Rapido
4683,6285_9_ba2a47d57aebf6fbcea02805f6f3bc88,Professionalitá
4684,6285_9_ba3c0895cece2740817fe0b01cdc9c23,Efficienza tecnico
4687,6285_9_ba809890ae8ba4a595152108823d987a,Ho dovuto segnalare il guasto con altra linea perché completamente isolato.
4688,6285_9_ba827c28f74fbf34bbbe71d0b52c8de0,Sono stati velocissimi
4689,6285_9_ba83181157400e31e63ffb3196d6e6df,Perché penso sia utile all’ operatore per sapere se lavora bene o si possono fare dei miglioramenti  dove ne possano beneficiare tutti sia  L utente che per appunto lo stesso operatore
4690,6285_9_ba8e903f1a6c52e1bb00dd0ebfb4b131,Il problema è stato risolto e anche molto velocemente con molta gentilezza degli operatori!
4691,6285_9_ba9e9d7a47832740d04ae18e4d7d7355,Competenze e cortesia
4692,6285_9_baa6449fdf81834b1477ec15c7efa09b,"Efficienza, competenza  e gentilezza."
4694,6285_9_bad4f4496b35d34d036cf14b870087f8,Perché l’assistente è stato gentile e mi ha risolto il problema alla linea
4696,6285_9_badf9cf9db370f037e9af5357de7207e,Il primo tecnico ha sbagliato la programmazione ..il secondo l ha risolta ..purtroppo da sabato pomeriggio ..a lunedì a mezzogiorno si è risolto il tutto...
4697,6285_9_bae42b24b9f830fcf94e77a0dd27242d,Risolto
4703,6285_9_bb32227b63ddeaa00555024b52cf53d3,Risposta e competenza
4704,6285_9_bb36189097af724673660abec2526218,Il tutto è stato soddisfacente
4705,6285_9_bb3dd0138fae1736f492ad4807ac302c,Problema risolto velocemente e gentilezza operatore
4707,6285_9_bb609ba2b40a94dea985c82340d58a95,.
4708,6285_9_bb681ac7b79d84f20a48ecc71156043c,Hanno soddisfato rapidamente le mie aspettative
4709,6285_9_bb752a0bb8301a3c50161e5beee98046,perché in 12 ore dopo che il problema non si risolveva mi ha contattato un tecnico la sera alle 22.00 gentilissimo e mi ha spiegato come procedere
4710,6285_9_bb760d403a8ccb009a262901259520d9,Non do il 10 perché si può sempre migliorare
4711,6285_9_bb8c231f3e8dc972985c41a9fd3739f9,Mi era stato detto che il problema sarebbe stato risolto il giorno dopo perché nelle ore notturne non è previsto l'intervento dei tecnici in centrale.Invece il problema è rientrato dopo un'ora
4712,6285_9_bb9885cd5b24ad93ab2dcc018be16960,Velocità nella risoluzione del problema
4713,6285_9_bbab3d4e5c4aee4020a5bc5a164df733,Disponibilità
4714,6285_9_bbb03e4461d880b6a8af2a090040a929,L'operatore  è stata bravissima e molto gentile
4717,6285_9_bbd133aebc9a2cfdd84ecc3dffcb30db,Sono stati celeri
4718,6285_9_bbee116d19b813809847e6f2524ae2fe,L'ultima operatrice che mi ha gestito e' stata eccellente a differenza dei 2 precedenti operatori nei giorni precedenti
4719,6285_9_bbfda1532cd94b6c075daeb710f34f84,Tecnico eccellente sul posto. Operatori 187 una estremamente maleducata(ed ignorante tecnicamente). Guasto spesso aperto e chiuso subito senza ragione. Ho dovuto insistere ed aprire il guasto 4 volte
4720,6285_9_bc1a5148a1fa2d94731691a95b234346,Il personale sempre pronto a trovarti una soluzione e l'app myTim è perfetta e fatta molto bene
4723,6285_9_bc371e1a747989b361684ee207404299,"L'assistenza é stata buona, il problema é a monte nel momento dell'attivazione del servizio dove non sono stati evidenziati i possibili problemi che si satebbero potuti verificare col tipo di impianto"
4724,6285_9_bc42b1c0982e2f4521314d18c2d59e88,Per migliorare il servizio.
4725,6285_9_bc5021751954dfb08772c4317b202f00,Sono intervenuti prima(!) che io segnalassi il problema!!!!
4726,6285_9_bc5784402e80ebe1da5492af709931db,Tutto ok
4727,6285_9_bc6c996e14ad348b6635ce4409865ef1,"L'operatrice era competente, molto spesso i vostri operatori non lo sono e brancolano nel buio"
4728,6285_9_bc850da4e7bf7f4541315978207a527c,Chiaro e rapido
4729,6285_9_bca53f7c6dc0d6f857697f5ba2ac0f94,Ottimo servizio
4730,6285_9_bcb29f8e65d63a70785c81bcaea9ff5d,Sono stati tutti molto gentili e attivi nel risolvere il mio problema.
4731,6285_9_bcbdf8a9e16c8bf16153d5e607c15e94,Operatore competente e disponibile
4732,6285_9_bcc2af3553fe82eeb6662d96f44eef63,Perché mi ritengo abbastanza sodisfatto
4733,6285_9_bcf6afb30231b743805b85aeb2251d25,È stato efficiente la vs operatrice
4737,6285_9_bd054e3e273732b39ef624bd8052df2a,Tecnico molto bravo e puntuale (voto 10). L’assistenza ha tardato a rispondermi al telefono
4738,6285_9_bd0a2ba37ecbcf7636eb380c65a78d98,Mi sono trovata bene e soddisfatta
4739,6285_9_bd13884cd1ce3bde22a3da533303dd63,Tempestivi ed efficienti
4740,6285_9_bd187b576e856494f46266fed63274c7,Celerità e professionalità
4742,6285_9_bd2f519c4a92cd0f01e7f2a8807cdc3a,Operatori gentili e operativi
4743,6285_9_bd3b5d0cdf0b3b668b4274254c208355,Perfetto
4744,6285_9_bd3c9d9419a0e4327e493965df32082a,Buona soluzione;ma tempi un
4745,6285_9_bd4e899a4643ab17cccf22df8c30f7f3,Mi sono trovato benissimo con il tecnico mandato molto meno con gli operatori telefonici
4747,6285_9_bd7611669c1baad110648a49a1bf4e2d,Abbastanza facile segnalare abbastanza veloce anche se aspetto a vedere che non si presenti di nuovo che la linea adsl e la fibra per ora sono molto poco affidabili
4748,6285_9_bd766d0d888978405bc9a403642cd727,Per mi hanno risolto il guasto nel giro di un paio di ore...molto veloci
4749,6285_9_bd7963b9720e3d96632023205f05ec54,"Sono stati corretti, rapidi e espliciti."
4750,6285_9_bd7aa1226c080fa6fbe934d53d339056,"Ottima la fase finale con l'intervento di un tecnico bravo e competente. Le fasi precedenti invece sono state caratterizzate da incertezza, poca informazione e tempi abnormi."
4751,6285_9_bd858b687810f0353c4e153589475cc3,Perché mi trovo molto bene con la vostra linea e il vostro servizio
4753,6285_9_bda93021161b75abdfa326f77e837387,Problema risolto e competenza
4754,6285_9_bdaaeb2f50eaaf2b78b5d318e3914621,Abbastanza soddisfatto
4755,6285_9_bdaf64e524592dda298af77082ccfc29,Tutto sommato una buona assistenza
4756,6285_9_bdb32cbbc31b05d7927c498da78470a4,"La soluzione è stata trovata, ma ho dovuto sollecitare perché si risolvesse il problema."
4757,6285_9_bdb88ea770be8405be0fc8f0ecde06e3,Tutto perfetto
4758,6285_9_bdc5bdeb5b25eb2472299bac77713f17,Per la tempistica a causa della quale ho fatto un sollecito
4760,6285_9_bdd9c600b07e7b6f62e8db9f845b3006,Qualità delle risposte e rapidità nella risoluzione del problema
4761,6285_9_bde12fd0c32dfcc27c3f30781c5e2ff0,Ok
4762,6285_9_bde25e04c8896bd6860ac26a069df49b,Tecnico competente ed educato
4763,6285_9_bde86c8ebcfe40615856739b72d1bb99,"Per il risultato che ad ora sembra aver risolto i miei problemi, ma le info di come intendeva procedere all'assistenza, non sono state molto chiare, lo dimostra il sollecito che ho mandato"
4764,6285_9_bde89c34780644ed4eeac0429f7dfc41,Perché tutti gli operatori si sono prodigati per la soluzione del problema.
4765,6285_9_bdfeb69eb60145c6d640e5d0fea31d0f,In rapporto alloperatore che ho di volta in volta incontrato
4766,6285_9_be004c4dc6a231da4737242c9758bc8b,.
4768,6285_9_be060d0a77d1d65dfcc3c6a2e0e45b6c,Perchè io non ho prove se loro effettivamente vengano e sistemino il gusto
4770,6285_9_be15cf52442af1d7fe68cf96453a901b,Semplicità nel comunicarlo e nella risoluzione
4774,6285_9_be3b5e419b64b623a62e51aa787ebb0f,Ho chiamato 187 per vedere perché non funziona il decoder TIMVISION. Subito hanno confermato che é un danno é ho potuto lo stesso giorno cambiare il decoder con uno nuovo. L‘operatore é stato cortese.
4776,6285_9_be5eea61efd305212a85b5990fe44e21,Efficiente
4777,6285_9_be645eff621071117f149b2eabe9c8ac,Velocita e risoluzione senza problemi
4778,6285_9_be6c623998847dc906fa0846b9b632b9,Perché potrebbe migliorare
4780,6285_9_be6f0d58b22b849f28c737458f0728a7,"A parte il primo contatto col 187, l'operatrice dovrebbe cambiare lavoro. Per il resto dell'assistenza tutto molto professionale"
4781,6285_9_be70f296e0c2ec8164160534616370fd,L'assistenza è stata ottima ma la velocità della fibra si è ridotta di molto
4783,6285_9_be7988d9157981d0ecfb890840ae1ee9,Quasi perfetti
4784,6285_9_be7ad7f36e9a69e36bdf7baa34d548bc,Facilità di comunicazione. Velocità di intervento e rispetto dei tempi.
4785,6285_9_be8012de74860ef143dea68883e3823f,Perché mi è stato dato un giorno ed un orario ma poi il tecnico mi ha richiamato dopo tre giorni io gli ho dovuto indicare dov’era il permutatore nel mio palazzo e poi da lì non ho ricevuto più notizi
4786,6285_9_be86317939a0a3c6cdfbd14ca6c8ec38,Risposte veloci con riavvio remoto del modem smart-fibra
4787,6285_9_be9f060a77a5e89aec59051bb6214d2b,Servizio efficiente e celere
4788,6285_9_bea152adcdebd0f5dcecd407ddaddaa9,Ce sempre da migliorare
4789,6285_9_beb74d33ce5928c9a6684e8b43bb411a,Tempestività nella soluzione del problema
