7563,6015_9_ec9d17514272211f9d7113e92dc2645d,Soddisfazione
7568,6015_9_ed370ed9ff81692b8f5ec8de7fd27ba7,Sono  stati  professionali
7569,6015_9_ed398c9c455baa5a42e084f76f218a63,Per la tempestività dell intervento le soluzioni per ridurre al minimo il disservizio
7572,6015_9_ed9f89cfcf274eac71a33d4ce840d569,Ottimo lavoro svolto
7573,6015_9_eda6d41f1119f827cf41a836c62644ff,Perché siamo rimasti molto soddisfatti
7574,6015_9_ee1f3a1e8819d2a788e4051c68e7e021,Perché ha risolto il mio problema con celerità e cortesia
7575,6015_9_ee69a493344a6ed0fa8bdf9c41a32de0,ok
7576,6015_9_ee9c8139b8d6cf478d29007c0b7c0ff1,Sono molto soddisfatta perché ho trovato persone gentili e preparate
7578,6015_9_eeb15e1e1aca135ca70a8a785044ac11,Sono rimasta soddisfatta dell'assistenza fornita. Guasto riparato nello stesso giorno dopo poche ore
7579,6015_9_eeb5627109cf8a15c5a68e302e4dfb50,Ottima puntualità
7582,6015_9_ef8951abe31e8c9e27538f6cd9f9ffcd,"Problema risolto, ma con 3 giorni lavorativi di ritardo"
7583,6015_9_ef8e243e0c04f6ecb70ff0efcf20bd8d,Per la valutazione generale
7585,6015_9_f03aa0bea1888fc5691044018c8d6add,"abbastanza buono, non rapidissimo"
7586,6015_9_f0c268280a92bb24dc9391aa2ae3560b,Perche.mi sono sentita truffata
7587,6015_9_f0fc4e4dea42eb49ad701b3d81bd8814,"facilità di segnalazione, risposta tempestiva e riparazione veloce"
7589,6015_9_f10b57be0a5f50e87471fc1183d9763a,Nel complesso sono soddisfatto
7590,6015_9_f10fe785d9d035b339a81cf3039ee553,Sono stato soddisfatto
7591,6015_9_f12a39403d0fb15d0fb4d1f3208d9cee,Disponibilità e competenza
7593,6015_9_f233df544e72c357e230a1543669f344,sono stati efficienti
7595,6015_9_f282b2455330c28efae8b49bed7200f1,Non mi hanno creato nessun disguido alla mia attività c’è stato tempismo professionalità nella risoluzione del problema
7596,6015_9_f2b6568e08b66a23d06f5d268caaf5b2,Per l'efficienza
7597,6015_9_f2cb3e18f1df7b2634043b0f037c8429,"Intervento entro i tempi prospettati, ma nessuna possibilità di contattare qualcuno in caso di necessità."
7598,6015_9_f2de9fd576aaa34cecd2fad47129f121,Per obiettività
7599,6015_9_f2e485ba395b8d4d868fbac85f66f284,La disponibilità e chiarezza usata dall'operatore
7603,6015_9_f353688ee62ce3bfb47e13a63066f5a4,Posso ritenermi soddisfatto
7607,6015_9_f3eef92fe82ceedbd5aeca02e1bca967,Per la.gentilezza e serietà
7610,6015_9_f44fd45530427cafba962a7f63c59fb4,Gentilezza disponibilità e competenza
7611,6015_9_f45ec919f133c43394b2efeec3f00ed1,Perché si è tutto risolto in tempi accettabili
7613,6015_9_f4d07d59332ceccb032c1e608f6fcfc5,Nonstante era complicato il guasto hanno risolto abbastanza velocemente
7617,6015_9_f5ee359d41ad6a5ad206c509867e5cb3,Tempistica rispettata
7618,6015_9_f6086f29d90e3aca61a673210f23f121,Dalle risposte ricevute sembra che dovrei risolvere in fretta.
7620,6015_9_f62a393195d1614640a2ee6567f6e4c6,Perché sono stati tempestivi e professionali
7621,6015_9_f65f3465006f48096337db6cee505d3a,Sono rimasto soddisfatto
7622,6015_9_f6a6e6056cb52eacfc99b8cdc5c01f99,Per accelerare la richiesta di domanda
7623,6015_9_f70b9050109a5f347f49d6c45e08cfb6,Velocità nel risolvere il guasto
7628,6015_9_f7f78b8082fbfb5444ca4547c28bd0fa,"Si sentiva male , tecnico sembrava straniero"
7631,6015_9_f83ce13e876f935a8b4f7f09d4ed3de9,Bravo il tecnico      attesa deludente preselezione
7632,6015_9_f844e26f7af54f96ae0d36ac3668c466,Efficiente e cortese.
7637,6015_9_f94f66429d9e74cc44bf203bfa58835e,Perché il primo tecnico se ne era lavato le mani del problema.Qquello che ha risolto il problema si è dimostrato molto più preparato.
7639,6015_9_f961e4e166e162f0ba6cfa3fe3811411,Perché TIM ha gestito la segnalazione in maniera eccellente
7640,6015_9_f97893fdf57dab9101a2b0fb0b7565cc,Sono stati bravi e corretti
7641,6015_9_f979f2314f87b251c6b1e9e9337476a8,Sono stati veloci ed hanno risolto il problema. Mi hanno anche chiamato per avvisarmi !!!
7642,6015_9_f97fc92a5f5c1de7316886a0d9c611ee,Efficienza
7644,6015_9_f9a65d4fe3f87ccc30a89d7951d79bb3,Competenza nell'ultimo operatore
7645,6015_9_f9be2c6f14c3e7b0c7b142f2ba957adb,Operatrice cortese educata e professionale. Politica Aziendale pessima ! 4 mesi per una voltura perdendo anche la possibilità di scaricare i costi aziendali !
7646,6015_9_f9c8b4590f00aa25097677d767db47dc,Motivo reale .
7649,6015_9_fa9cfa4c404a6d6038071e5a91a1e3cd,Nonostante siano arrivati dopo 48 ore dalla segnalazione i tecnici sono sembrati competenti e disponibili
7650,6015_9_fadbe5a28a8cf56442f19675dd5ff251,L'operatore è stato bravissimo ma la afsl non funziona ancora correttamente
7651,6015_9_fae84e187d3f3b91ba4212aad39db2c5,Il problema è stato risolto
7658,6015_9_fc34201e7885530834d0bcbd57bfb97b,"Si è impegnato molto l'operatore, e si è prodigato assai per far sì che il problema venisse risolto entro 24 ore, mandando il tecnico..E così è stato, al mattino era tutto funzionante come prima."
7664,6015_9_fd38d671506bc2f11a8b325eec1f95ec,"Perché prima di trovare l'operatore,ho fatto diverse segnalazioni con anche interventi dei tecnici senza mai trovare una soluzione duratura."
7665,6015_9_fd72e1c8effb3d1c2eb30ed05f6c6b22,Efficienti
7666,6015_9_fe1f153e393365757c28b9d11ea13237,Per come è stato gestito il guasto
7668,6015_9_fe5b6fc58e226eb99dd5056907b27dc0,Ancora non ho risolto il problema
7669,6015_9_fe85e64ae3c7563ca348ff39090b7f4d,....
7670,6015_9_fead6865a0a1adc97f34f24537fe5f6d,"Sono intervenuti sia in assistenza telefonica sia il tecnico Tim. Il problema non è risolto, ma è stato preso in carico solertemente."
7671,6015_9_fec407f522329f63a7d5a397b940cec5,Per l'efficenza dimostrata
7672,6015_9_fecc2cefcb764fe4d571eca746e16494,Sono contento con I servizi e I tecnici. È la lines che da noise fa sempre I problem. È troppo lunga.
7674,6015_9_ff422e45b2bc20e57394f6677243b236,Sono stata molto soddisfatta del’opertor
7676,6015_9_ff876d517c9860b054a605f24e6831dc,"L''operatore ha svolto un ottimo lavoro, con pazienza ha seguito il cliente, risolvendo il problema con professionalità!"
7685,6015_28_2137ddc32c99974f47f647d83e6f9b67,Gentili  competenti e pazienti
7690,6015_28_2f157b9ebe90cc42b33e82b9f22ce6b3,La maleducazione degli albanesi
7692,6015_28_38f5b8f1b8148739fb82f2fd4f460bbe,Cordialità e competenza
7699,6015_28_5b9a9c81754f1451dd751dd53c538907,Massima disponibilità e gentilezza.
7708,6015_28_83537e5dee29dbfdd4a07a28c8a94088,Non hanno risposto o mi hanno lasciato in attesa
7716,6015_28_a1c93e3fa1319a94162855844b3fe92a,L' operatore ha fatto il possibile
7721,6015_28_b8bb05f1f1df7c3f4ecf9146a49fca83,Un azienda commerciale non può rimanere una settimana senza linea telefonica
7732,6333_9_0027e9c3e58af74dd4d6eae5a50737cf,Personale competente
7736,6333_9_003d21ac1e33dd13c4ce4d926ed38854,Il problema è stato risolto
7737,6333_9_003f660e1d2a6656d270dd1f7ff69708,"Buono, ma nella zona dove lavoro va migliorato"
7741,6333_9_0065aa2fc0010ba7cdb2947f02f5028d,Nessun motivo
7749,6333_9_00c01bcb68585101fd6184d9a72eb399,Perché si
7751,6333_9_00c874097fa7879ba41223ea2322d250,Soddisfatto della richiesta
7754,6333_9_00cce156bffd75a17b8f55541319dd3e,"Gentilezza,professionalità"
7756,6333_9_00f617636a5a8958f250d719c8b0bb8d,Z
7758,6333_9_012172bb802a3a736a7d6212784ecb6e,Precisione
7759,6333_9_012470c0ae3dafc9a1d52187cea7fd74,Cordialita e puntualita con auguri di buona pasqua da parte dell'operatore che ha risposto alla chiamata
7761,6333_9_0160c71881e03fe138fc00d4a500b365,Perché l'assistenza sia telefonica che del tecnico al mio domicilio si è rivelata all'altezza delle mie aspettative
7762,6333_9_0166d505c942d53041b221a073167b4e,Il tecnico e stato competente
7765,6333_9_01939cd77918649f6fbca74f596bf685,La cordialità della operatrice telefonica. L'impegno del tecnico una volta arrivato. La linea è di nuovo operativa.
7766,6333_9_0195f67e5cf21438cedcec4ae37690ef,Il problema doveva essere risolto entro il giorno successivo come da voi dichiarato è stato risolto al quarto giorno
7768,6333_9_01f9622e05db1656b6d38b83d767598d,Rapidi efficienti competenti
7769,6333_9_021a20e1803481604f197bf4a86ddc23,Tutto sommato abbiamo risolto
7772,6333_9_0253764ab72367baa5aa0dbcae73a310,"Gentilezza, professionalità e serietà"
7774,6333_9_02adbf7112d2b247ee6b0b655be7c1d6,operatore bravissimo
7775,6333_9_02b34c6a981b967cf54db68d147bcff0,Dovevate essere piu chiari e precisi quando ho parlato col 191
7776,6333_9_02b99c8826dc0744637ccc596c3c3d2e,"LE TEMPISTICHE INDICATE SONO STATE RISPETTATE NONOSTANTE,IL SERVIZIO E'STATO EFFICIENTE, SONO STATA CONTATTATA PIU' VOLTE DA DIVERSI OPERATORI PER AVERE INDICAZIONI IN MERITO. SODDISFATTA"
7777,6333_9_02c58b7b7b83b9933b5033adb74b6f29,Problema risolto veloce cemente
7779,6333_9_0309f9b5071fa04a0f42479130c71e76,Buon servizio.
7782,6333_9_03378a4a13dd0a2204e6a8b0057aa3b2,Buono
7783,6333_9_0340855869d164ee521d3aa83055235b,Perché è stato un servizio buono
7784,6333_9_03574b6d925ba6c9e05ee8aa4815c48d,Risolto il guasto in un giorno
7785,6333_9_035a190743e66574eb175996839037a8,Tutto risolto velocemente e gentilmente
7786,6333_9_0362251dab5e2b6021a11d4081379b42,Sono stato pienamente soddisfatto dell’operato degli interlocutori
7788,6333_9_038d97af07d432ccdfcdb90c0e1c14a2,Sono rimasto soddisfatto
7789,6333_9_03a77d19464c4e354da433cdf0a50d69,Completamente soddisfatto dalla gentilezza dell'operatore alla risoluzione veloce del problema
7791,6333_9_03d4b8a114004e2c2d2f5b62abb3ca6c,Solo per l’operatore perché è stato molto professionale . Se fosse per riuscire a prendere la linea sarebbe un 1
7794,6333_9_03dfb0085e4071fe653658f5553e7dad,"Perché nonostante i diversi solleciti alla fine il tecnico, persona molto gentile e disponibile, ha risolto il problema."
7795,6333_9_03ea0f1ec6accea80996e14a443b3878,Il problema si è risolto da solo mentre ero in linea con operatore
7797,6333_9_042073c4f40d409452052856ffd0f2b4,"Per la capacità del tecnico di risolvere velocemente il problema, nonostante l'attesa dell'intervento"
7800,6333_9_043243241264835fb6b5af53ebb1e6d7,ottimo
7802,6333_9_04456627090037a9619c2cee5774d70e,Competenza e gentilezza
7807,6333_9_04824172515957346f298b85dd5b49e9,Cortesia dell'operatore e buona tempistica nella risoluzione del problema
7809,6333_9_048d106c16e9ad8fbe401095518dc877,Era veloce e perfetto
7810,6333_9_04a084dbed028c65998408b03a5042c3,perché il tecnico Tim uscito nell'ultimo intervento era competente
7811,6333_9_04a1c7a7685478eb07f20285b9cd579d,Sono stato soddisfatto
7812,6333_9_04b196d9d1fb2de54b535b1bffa45ee8,Sempre molto  professionali
7813,6333_9_04bac905af9f1ecd9cb2eb72ebb4c8c3,Perche tim ha un servizio impeccabile
7814,6333_9_04d209834d8b36e49788726428eaec2b,"Facilità, competenza"
7816,6333_9_04e61cdc41eafac96fb8555545c95f33,Perché è stato risolto in giornata
7817,6333_9_04f3a57e393e58b477da1a8258797a90,10 si da alla perfezione e prima di riuscire a parlare con un operatore ho dovuto chiamare 3 volte
7819,6333_9_055dec61d374b7c6b56112c70a366934,"Il tecnico era veramente preparato, è stato risoluto nel cercare di individuare il problema e la sua soluzione e rapido nel risolverlo."
7820,6333_9_05746ae2bbe74eadb7b9df5866b5e8cf,Perché l’operatore che mi ha seguito è stato bravo
7821,6333_9_0576ef9578741c9e71c0acf622670012,Per la celerità e cortesia
7822,6333_9_05912af1f54d083ced4bc9ad55d8c163,Perchè sono stati cordiali e professionali
7823,6333_9_05a1a0e5b683ee3346808ba5b4b5ca81,Tecnico capace..gentile...ordinato..veloce nel capire il problema è risolverlo..sa fare il suo dovere..
7826,6333_9_05bc1f6da3cdcba1cadb75f837e48546,L'operatore era molto competente e disponibile.
7828,6333_9_05ca30b4c9bea5354638eff25b4c09aa,Soddisfatto
7829,6333_9_05d5df92b07c71841c2745b60da453e8,Cortesia Efficenza Tempistica
7830,6333_9_05e636da5bde9bb6576a702297e42c4b,Perché il problema è stato risolto nei tempi previsti
7833,6333_9_062943cb306c181ddb217fb1afbe7018,Questa volta è stato risolto
7835,6333_9_0650c1c1a1f7fb2982ef525f1c515562,Perché l'attesa é stata troppa per chi a un negozio
7836,6333_9_066c095a883a741ab58eccd2f7ad0224,Tecnico preparato.
7837,6333_9_0672b54ae7d516713edc9e41cf5ba258,Perché mi avete chiesto di votare
7839,6333_9_069355eb2ecff7bba637f2ba7a5a9881,Quando si sono attivati cone fivevsno è stato risolto in tempi ragionevoli
7840,6333_9_06a3c1fb2e2a937e6f4e2c24106d4a23,"Sono stati tutti competenti, tempestivi e cortesi."
7842,6333_9_06bc118c8a41eef8296c9b8577884963,G
7843,6333_9_06c3a1d2ad6fb26f78ce1dc35a4bd553,Tutto bene il tecnico preciso e competente
7847,6333_9_07008ff38f52ba4900b11670076a3680,perché sono rimasta soddisfatta
7848,6333_9_0708d0f7496af5f9aa09c3e42a824c65,"Segnalato calo resa adsl, forum contatto non semplicissimo da trovare. Tecnico arriva dopo 4-5 giorni poco preavviso e rimando al giorno s Guasto pare da lui risolto ma resa dell'ADSL ancora scarsa"
7850,6333_9_070cf7a6376210a9c07ae3c8c78c552e,Perché risolto abbastanza velocemente
7853,6333_9_073ca725b24eaeab2995dd2ceefe389e,"Soddisfazione per la celerita"""
7855,6333_9_075700fde9f3a0b1958130a7798e481f,Perché mi sembra buono ma non ottimo
7856,6333_9_075a5de93333bf9b0e1bf7c8fd89c36d,Per la velocità di risoluzione del problema
7858,6333_9_07967936fca9a66f388a8b4ba7df9e57,Tutto ok
7860,6333_9_07a100dc280923c8f6c9483724be7604,"Il problema si è risolto subito, gli operatori sono stati efficienti e gentili."
7863,6333_9_0820d9f85df5b34390c4fb1cebec6fab,problema risolto
7865,6333_9_0854d40777430e9ccae33c32553d18ab,Per competenza e attenzione dell'interlocutore
7866,6333_9_087ee1a00ffa148e761877b7c15d24eb,Gentilezza e professionalità
7868,6333_9_0892edd978e883f4c24a86e7c7733808,Nonostante il problema riscontrato dipendesse direttamente dalla centrale l'intervento è stato tempestivo e risolutivo.
7871,6333_9_08c020c3ffdacd63290dc3a40592ecf6,Perché si
7872,6333_9_08e1540756fd15392e5a17f28a6702ac,Per la gentilezza e la competenza dell'operatore
7873,6333_9_08ef22ab5b3523e5b812b6e5cd47d3e9,"Tempi corretti buon followup del problema. Alla prima telefonata di segnalazione non esiste la voce ""assistenza tecnica"", solo la cortesia di un'operatrice ha potuto supplire"
7876,6333_9_091349e3a34e125d4b8285e93598809a,Al call center 191 il tecnico è stato preciso
7877,6333_9_091c01b15d63f210be375b6a3130bd70,Cosi
7878,6333_9_09266001a240c308c67e209703b4cd81,Perché mi sono trovato bene
7880,6333_9_0943d9d80b416749114833eaf29d6e76,X
7881,6333_9_09484a0808ed3fda52f19cf969d72869,Il tutto si è risolto in breve tempo e anche l'operatore telefonico è stato gentile e soddisfacente in merito. Grazie
7882,6333_9_095f4b56eae81e617d0b9f5243d4fe9e,perché la riparazione del guasto ha richiesto più di una settimana troppo per una farmacia.
7885,6333_9_096585d851d3515989e22fde559cb911,Buona comunicazione alla segnalazione. Tecnico competente e gentilissimo. Risolto velocemente il guasto.
7886,6333_9_0966829a26724053a2bbcf330ff25205,Perché lo meritate
7888,6333_9_09860238920bbb0f9d1453dbec89e6ba,per la cortesia e disponibilita
7889,6333_9_09936c3706d46652192556f88ff4310e,Perché  è stato risolto in breve tempo
7890,6333_9_099a70afb79c8aa706a2082cb4f20613,Problema risolto ma si potevano velocizzare i tempi di risoluzione
7895,6333_9_0a0fb99540e122eaec7cfab6f704ce62,Per la gentilezza
7896,6333_9_0a1968af61f578d1d6d021bcae97c145,Con cortesia e professionalità è stato risolto il problema direttamente stando al telefono. Operatore molto cordiale e preparato
7897,6333_9_0a2dd2b15d6f67cb3d09e1b8e5a22539,Tutto si e’ Svolto bene il tecnico e’ stato veloce disponibile e competente ed e’ arrivato anche sabato
7898,6333_9_0a66504ced102c98a4aef1a4ff52ff09,È un voto complessivo considerando anche i trascorsi con Telecom.
7899,6333_9_0a68d180e5fbf2c4051a4cea04bf6220,Tutto ok
7902,6333_9_0a831ee8b7714defbff271705e4d4613,Operatore cordiale
7904,6333_9_0ab6001a0be363d09feb499c8c5879f3,"Tecnici disponibilissimi,ma servizio telefonico molto lento."
7905,6333_9_0ae858170caa4e4a908bf5a61aa38dd6,Ottima risoluzione ma con qualche ritardo
7909,6333_9_0b5165e05bc23efd08c1433bc0350df2,Tempo di attesa
7913,6333_9_0bbc11a307b242a711df967ce533fbe7,Tutto ok
7914,6333_9_0bce86a636d98e64be6decb1c2218437,"Perché il tecnico è stato tempestivo nel raggiungere il mio domicilio, anche se non ha risolto il problema."
7915,6333_9_0bd491ff43a9f979f7917833bf1588d6,"Assistenza veloce e precisa, molto gentile"
7916,6333_9_0be80e45a11742ca9af48baeb2bd8510,Per il momento è tutto a posto ma il problema si potrebbe ripresentare
7917,6333_9_0c06abb88f7aaf1b499c543c67ba86d8,Perché aspetto che il tecnico mi chiami in quanto il servizio internet non è consecutivo Grazie
7918,6333_9_0c1d9098092eef79aa686c12b589d785,Il problema è stato risolto
7919,6333_9_0c4cd9dd2b8497bf557ff3bc46c31f26,Celerità
7920,6333_9_0c4ff2d99d744c415eecefc3a9da7f72,Il problema è stato risolto in tempi brevi.
7922,6333_9_0c59de4f58a0686faed8577c8db6d12e,Un giusto compromesso
7925,6333_9_0c9071d558c364ea9c85618499b69d08,"Perché il problema è stato risolto in modo veloce e appropriato, importantissimo considerando la linea tipo business."
7926,6333_9_0cb106e09ec7c099a8e6f0cd5618e25f,Gli operatori contattato sempre gentili e molto preparati. Il problema non è stato risolto a causa di un problema legato a modem fibra che non accetta aggiornamenti firmware.
7928,6333_9_0cc5178401109eb7952c039d28385e34,Pronta soluzione al problema senza ritardi ne solleciti
7929,6333_9_0cd23b7d59c5e1ec5cea924a803e7194,Gentilezza
7931,6333_9_0cf8920b75b28c185b7340ba966a99a8,Per l’efficienza e la professionalità
7933,6333_9_0d00fd35e01b65969b4e43ab62262ef3,La risoluzione del problema è stata veloce e non ha inciso sull’attività aziendale.
7934,6333_9_0d01ef265e03c0045f9faba92e1184ab,Sono soddisfatto
7935,6333_9_0d0f52654ad914539ab38c1191edb771,Per la cortesia e assistenza
7937,6333_9_0d1d32b6b52752d6ebd9c9e8c1c4faf8,Per la difficoltà a parlare con l ‘operatore
7939,6333_9_0d53fcc7155dd07d93fdec02c4e18b6d,Il tecnico è stato molto competente e cordiale
7940,6333_9_0d5b841ba1e03efa45d0b8767b7e89fc,"La ragazza dell'ufficio tecnico è stata bravissima e gentilissima, ha risolto il problema in poco tempo."
7941,6333_9_0d64b770772ea1a012ed1d683ee2e210,Perché lo ritengo giusto
7943,6333_9_0d7f0df99d9d13b47dc2b1fb43250ecf,"Servizio discreto, ma un po lento."
7944,6333_9_0d847f07174501440d2e025fda6a9eea,Il tecnico si è impegnato a controllare anche un’ulteriore anomalia riscontrata in centrale.
7946,6333_9_0d9ad342e1560b63f8cae6a41f7710ba,"L'intervento è avvenuto in tempi adeguati, i tecnici hanno lavorato con scrupolo e non hanno lasciato nulla di intentato."
7947,6333_9_0dc0d8bb626c2c60a9bdc9f7e1dd4b7a,Una volta individuato il ghasto sono stati celeri.
7948,6333_9_0dccd676e625a3e633e071b65948a4a5,Sono stati celeri ed il tecnico immediato nella risoluzione del problema. L'unico appunto è stato quello di non aver preso unappuntamento
7949,6333_9_0de902e6e8ba1fee0d26580ed8b26aa9,"Personale competente, gentile e disponibile"
7950,6333_9_0df7caf52aa64ed10ccccddf537af866,Sono soddisfatto
7952,6333_9_0e27f393f81bbd9c0ce703105b69c302,.....
7953,6333_9_0e3453aefd9b7f45b31ebf88acdb7cd3,L'ultima operatrice è stata efficiente brava
7954,6333_9_0e87522c3eb13260cbae098301bf198f,Risoluzione veloce e personale molto disponibile
7956,6333_9_0ea3fd52a672bee873b2d61e431afde0,Tutto ok
7958,6333_9_0ebe24c6362c6468e989658675619d91,Buona assistenza telefonica e buona assistenza tecnica in sede.
7959,6333_9_0ee5caa2f0d1a6243f0cd49b69e8551f,"Tutto ok, rapido, cortese"
7961,6333_9_0f2446908c19e31c07d7ff4dec9adadd,Perché si è risolto tutto nei tempi detti
7962,6333_9_0f2b339bbaf0433ec0096a07d238e713,Per la cortesia e la velocità nell' intervento
7963,6333_9_0f5f350f1bb281475d29f81972adb6bb,è stato risolto alla seconsa segnalazione
7965,6333_9_0f68ba11b6d470f42e679055a6b01ab6,Operatori competenti
7966,6333_9_0f7031c6a01e2a585c4804d7f0aedecc,Perché il problema si è ripetuto
7967,6333_9_0f710f6744812d3a1830c0b055e91087,Tutto nella norma
7968,6333_9_0f725778ff16432665b1a570a709e99e,Perché l'operatore è stato competente e abbiamo risolto il guasto
7970,6333_9_0f847e18eeac802231903a1f07c6cd31,Per l’efficacia
7971,6333_9_0f87af2ab6122bf0b06959933bbdc4a0,Operatrice cordiale. Ha risoto il problema prontamente
7973,6333_9_0fa04f57e9e1772223737ff180c53eb2,Perché da spesso problemi
7976,6333_9_0fa67ed2c40d97eafb19c33ccd7fe022,Velocità
7977,6333_9_0faf8f51f6690abe537d92e80ef4d9c2,Abbastanza tempestivi e cordiali
7978,6333_9_0fc6e3876590b9b837f19f50eefbca92,Ho avuto la risoluzione del problema nel giro di due ore
7979,6333_9_0fcf6bdbfa1345def48aed6975335fd6,Ho un esercizio commerciale e il problema segnalato è stato risolto dopo 2 giorni. Sarebbe utile poter contare su un tecnico reperibile anche sabato  e fesrivi
7981,6333_9_0fe4d6ade07bfb827d75f0ae54caee03,Efficienti e gentili
7994,6333_9_106cf024875bfe8dfa2bf2face0ce7f1,"Operatrice italiana, che ha risolto velocemente i mie problemi e ha saputo rispondere alle mie domande."
7998,6333_9_10b61ba297644281dd1b37364e06c6d3,tutto risolto e personale intervenuto competente e preparato
7999,6333_9_10b648e4f14e30fc3821edf751c6ccb6,Il problema sembrerebbe essere stato generato da un intervento di tecnici Telecom intervenuti il giorno precedente nella stessa zona
8000,6333_9_10c0028e208c633569e34a7a6ea28e85,Risoluzione guasto ok Ma prendere la linea al 191 è sempre drammatico
8002,6333_9_10f63480602a4e419d52bd6eded81b95,Perché sono stati rispettati i tempi di per la risoluzione del disservizio
8003,6333_9_10fece411dced6998a8f0047272f12ca,Perché ha dato impulso prioritariamente al pagamento dell’intervento senza aver accertato se il mal funzionamento potesse dipendere dal modem
8004,6333_9_11003037cdfb8422d2ca2dfb7f9f292c,Se l'inconveniente fosse durato meno avrwi dato 10
8006,6333_9_11166e6ee584761f918c991b5e745b99,Risultato eccellente
8007,6333_9_111db6ae9b44c8aca59661f0d8fc8f74,Per l’efficienza
8009,6333_9_112707685a0918b40b01db5e603304b8,Soddisfatto
8010,6333_9_11290f14ac36a9f92ff306c353e0cdd1,Soddisfatto
8011,6333_9_11514caa58c32422ede572b588d44235,Efficienza nella comprensione del problema e della presa in carico e risoluzione positiva
8014,6333_9_118a752167fe5d720b7ce11a5732249e,È stato bravissimo
8016,6333_9_11ae98dc30c66530fd00e4044b93240f,Risolto tutto anche se era sabato
8023,6333_9_122a2d02941f8343fadd2006d9869ee8,Veloce e professionale
8025,6333_9_126abef970c3f998082572613835410d,Ottimo servizio
8026,6333_9_126d666a01fe58f55af8eeeb7e852c4b,Sicuramente si sarebbe potuto fare meglio
8027,6333_9_127e88d6255e02586c26c41aca54a62a,Tutto perfetto
8028,6333_9_1284526b258959a3ae8d044f5639f8f6,Veloce soluzione ed operatore molto cordiale e proattivo
8030,6333_9_12929b408e070d13d5fbf0fc10d0199f,L’ultkmo Tecnico ha risolto il problema dopo che vari tecnici hanno fallito
8031,6333_9_12a6a9fc99a4376e7d38a79605c19c2a,Soluzione veloce del problema. Efficienza e cortesia del tecnico
8034,6333_9_12b3816d404c74a792315c03e44bb9cc,L'operatore ha risolto il problema.
8035,6333_9_12c8b43ca1f9a3de52f2531cea6a988b,Problema risolto.
8040,6333_9_1315ad03ccb6ccd9611b1943aa619e09,"La ragazza al telefono è stata gentilissima, competente e sipinivile"
8043,6333_9_13607a5f0c78ecb14883516a17e780f2,Il problema e' stato risolto velocemente
8045,6333_9_1375e669aa50130add8c0ac8031bb4ed,Il 10 rappresenta la perfezione il voto sotto a 5 corrisponde ad una non soluzione del guasto il fatto che ho sollecitato ha fatto perdere un punto
8046,6333_9_1383a7413e9995f8ae3f16391bb274d6,Veloce e preciso
8047,6333_9_139a60fa67506762071a07ea718c8002,Veloce gentile preparato
8051,6333_9_13d5841fcbf7f32230f7b76589cfd706,"Ho chiamato,ho spiegato il problema,han capito il problema è hanno risolto"
8052,6333_9_13e6f3e5a11133081509b9d6b6496558,Avevo un problema di Linea su internet e il vostro operatore ha risolto all'istante
8054,6333_9_13fa22514c7c479f7e67a6baa600a0db,Il giusto
8055,6333_9_14028a446becb5a9d4e0ffc9a13fecdd,Troppo tempo
8056,6333_9_141d5f94a0764876f4499c2f07e916a9,Cordialita
8057,6333_9_141f946eab881e7fb8efe0c44e2e7cef,"Gli operatori sono tutti efficienti,disponibili,pazienti e gentili"
8058,6333_9_143867dc503d274e743cfd8377daa2f2,"Sono stati disponibili, chiari e abbastanza veloci"
8059,6333_9_143b354139afd3549bfce6b64d51b470,     Servizio ottimo
8061,6333_9_144e3c7d4bdd879d796f909388396ffa,Risoluzione problema
8063,6333_9_14913a381be9ae601e3c8717da1f24ba,Per la gentilezza degli operatori e la loro disponibilità e professionalità nel trattare la segnalazione
8064,6333_9_149321b40af54db52dcb092f7f7c3c32,Difficoltoso contattare l operatore telefonico l ultimo è stato efficiente gli altri lavativi
8065,6333_9_149d50a79ff388159a8f2d09cf0c4043,Tempestività
8067,6333_9_14c75151255b8d7d30dcde8ed49d56a9,Positiva
8068,6333_9_14e46855ec33d256dc2439cd21a61af7,Dire pienamente soddisfatti lo trovo azzardato
8069,6333_9_14efbe5f894376343e6dcc133f7c5007,Per la velocità di risoluzione  del problema.
8070,6333_9_15041e476c55d6f0cecb0606c29d61d0,Problema risolto
8071,6333_9_151f0d80161a1ba6ac5bcb586ab1dbd5,Efficienti ed efficaci
8074,6333_9_155593ae11ba9909c11570052600497c,Per la disponibilità
8075,6333_9_155852f902d6b0d3d09df08459a300c8,Assistenza buona
8076,6333_9_1588800f12cb999cbcd433cbc1fb129a,Perché l operatrice è stata rapida e cortese
8078,6333_9_15cec57d79c37d67c6de4d10754b13c0,Tutto senza problemi
8079,6333_9_15d16dc8a5651e6ccc8aa2410313485a,Durante l’installazione della fibra il tecnico ha tagliato il filo di un telefono e ha lasciato ai miei genitori (79 e 87 anni) un router da configurare senza dirgli nemmeno dove fosse scritta la psw
8080,6333_9_161ce8f76026bb61b604216ab31696ae,Ottimo..ma farei tutto via email
8081,6333_9_162c6f7dbbb4a80dd86ac62c07a31b26,Il problema è stato risolto e sia operatore che tecnico sono stati molto cordiali.
8082,6333_9_164814d11d9da01f23133d0f8f77d5e3,Grazie
8087,6333_9_1691cb75430571d291b9d2d4cf995062,Operatrice professionale e gentile
8088,6333_9_1698821454c3e56f93a4a20b9532c217,Cortesia e competenza
